"I () I, the ninth letter of the English alphabet, takes its form from the Phoenician, through the Latin and the Greek. The Phoenician letter was probably of Egyptian origin. Its original value was nearly the same as that of the Italian I, or long e as in mete. Etymologically I is most closely related to e, y, j, g; as in dint, dent, beverage, L. bibere; E. kin, AS. cynn; E. thin, AS. /ynne; E. dominion, donjon, dungeon.",FALSE
"I () In our old authors, I was often used for ay (or aye), yes, which is pronounced nearly like it.",TRUE
"I () As a numeral, I stands for 1, II for 2, etc.",FALSE
I- (prefix.) See Y-.,TRUE
We (pl. ) of I,FALSE
Our (pl. ) of I,TRUE
Ours (pl. ) of I,FALSE
Us (pl. ) of I,TRUE
I (object.) The nominative case of the pronoun of the first person; the word with which a speaker or writer denotes himself.,FALSE
Iamatology (n.) Materia Medica; that branch of therapeutics which treats of remedies.,TRUE
Iamb (n.) An iambus or iambic.,FALSE
"Iambic (a.) Consisting of a short syllable followed by a long one, or of an unaccented syllable followed by an accented; as, an iambic foot.",TRUE
"Iambic (a.) Pertaining to, or composed of, iambics; as, an iambic verse; iambic meter. See Lambus.",FALSE
Iambic (n.) An iambic foot; an iambus.,TRUE
Iambic (n.) A verse composed of iambic feet.,FALSE
Iambic (n.) A satirical poem (such poems having been anciently written in iambic verse); a satire; a lampoon.,TRUE
Iambical (a.) Iambic.,FALSE
Iambically (adv.) In a iambic manner; after the manner of iambics.,TRUE
Iambize (v. t.) To satirize in iambics; to lampoon.,FALSE
Iambi (pl. ) of Iambus,TRUE
Iambuses (pl. ) of Iambus,FALSE
"Iambus (n.) A foot consisting of a short syllable followed by a long one, as in /mans, or of an unaccented syllable followed by an accented one, as invent; an iambic. See the Couplet under Iambic, n.",TRUE
Ianthinae (pl. ) of Ianthina,FALSE
Ianthinas (pl. ) of Ianthina,TRUE
"Ianthina (n.) Any gastropod of the genus Ianthina, of which various species are found living in mid ocean; -- called also purple shell, and violet snail.",FALSE
"Iatraliptic (a.) Treating diseases by anointing and friction; as, the iatraliptic method.",TRUE
Iatric (a.) Alt. of Iatrical,FALSE
"Iatrical (a.) Of or pertaining to medicine, or to medical men.",TRUE
"Iatrochemical (a.) Of or pertaining to iatrochemistry, or to the iatrochemists.",FALSE
Iatrochemist (n.) A physician who explained or treated diseases upon chemical principles; one who practiced iatrochemistry.,TRUE
"Iatrochemistry (n.) Chemistry applied to, or used in, medicine; -- used especially with reference to the doctrines in the school of physicians in Flanders, in the 17th century, who held that health depends upon the proper chemical relations of the fluids of the body, and who endeavored to explain the conditions of health or disease by chemical principles.",FALSE
Iatromathematical (a.) Of or pertaining to iatromathematicians or their doctrine.,TRUE
"Iatromathematician (n.) One of a school of physicians in Italy, about the middle of the 17th century, who tried to apply the laws of mechanics and mathematics to the human body, and hence were eager student of anatomy; -- opposed to the iatrochemists.",FALSE
Iberian (a.) Of or pertaining to Iberia.,TRUE
Ibexes (pl. ) of Ibex,FALSE
Ibices (pl. ) of Ibex,TRUE
"Ibex (n.) One of several species of wild goats having very large, recurved horns, transversely ridged in front; -- called also steinbok.",FALSE
Ibidem (adv.) In the same place; -- abbreviated ibid. or ib.,TRUE
"Ibis (n.) Any bird of the genus Ibis and several allied genera, of the family Ibidae, inhabiting both the Old World and the New. Numerous species are known. They are large, wading birds, having a long, curved beak, and feed largely on reptiles.",FALSE
-ible () See -able.,TRUE
"-ic () A suffix signifying, in general, relating to, or characteristic of; as, historic, hygienic, telegraphic, etc.",FALSE
"-ic () A suffix, denoting that the element indicated enters into certain compounds with its highest valence, or with a valence relatively higher than in compounds where the name of the element ends in -ous; as, ferric, sulphuric. It is also used in the general sense of pertaining to; as, hydric, sodic, calcic.",TRUE
"Icarian (a.) Soaring too high for safety, like Icarus; adventurous in flight.",FALSE
"Ice (n.) Water or other fluid frozen or reduced to the solid state by cold; frozen water. It is a white or transparent colorless substance, crystalline, brittle, and viscoidal. Its specific gravity (0.92, that of water at 4¡ C. being 1.0) being less than that of water, ice floats.",TRUE
Ice (n.) Concreted sugar.,FALSE
"Ice (n.) Water, cream, custard, etc., sweetened, flavored, and artificially frozen.",TRUE
"Ice (n.) Any substance having the appearance of ice; as, camphor ice.",FALSE
Iced (imp. & p. p.) of Ice,TRUE
Icing (p. pr. & vb. n.) of Ice,FALSE
"Ice (v. t.) To cover with ice; to convert into ice, or into something resembling ice.",TRUE
"Ice (v. t.) To cover with icing, or frosting made of sugar and milk or white of egg; to frost, as cakes, tarts, etc.",FALSE
"Ice (v. t.) To chill or cool, as with ice; to freeze.",TRUE
"Iceberg (n.) A large mass of ice, generally floating in the ocean.",FALSE
"Icebird (n.) An Arctic sea bird, as the Arctic fulmar.",TRUE
"Icebound (a.) Totally surrounded with ice, so as to be incapable of advancing; as, an icebound vessel; also, surrounded by or fringed with ice so as to hinder easy access; as, an icebound coast.",FALSE
Ice-built (a.) Composed of ice.,TRUE
Ice-built (a.) Loaded with ice.,FALSE
"Iced (a.) Covered with ice; chilled with ice; as, iced water.",TRUE
"Iced (a.) Covered with something resembling ice, as sugar icing; frosted; as, iced cake.",FALSE
"Icefall (n.) A frozen waterfall, or mass of ice resembling a frozen waterfall.",TRUE
"Icelander (n.) A native, or one of the Scandinavian people, of Iceland.",FALSE
"Icelandic (a.) Of or pertaining to Iceland; relating to, or resembling, the Icelanders.",TRUE
"Icelandic (n.) The language of the Icelanders. It is one of the Scandinavian group, and is more nearly allied to the Old Norse than any other language now spoken.",FALSE
"Iceland moss () A kind of lichen (Cetraria Icelandica) found from the Arctic regions to the North Temperate zone. It furnishes a nutritious jelly and other forms of food, and is used in pulmonary complaints as a demulcent.",TRUE
"Iceland spar () A transparent variety of calcite, the best of which is obtained in Iceland. It is used for the prisms of the polariscope, because of its strong double refraction. Cf. Calcite.",FALSE
Icemen (pl. ) of Iceman,TRUE
"Iceman (n.) A man who is skilled in traveling upon ice, as among glaciers.",FALSE
Iceman (n.) One who deals in ice; one who retails or delivers ice.,TRUE
"Ice plant () A plant (Mesembryanthemum crystallinum), sprinkled with pellucid, watery vesicles, which glisten like ice. It is native along the Mediterranean, in the Canaries, and in South Africa. Its juice is said to be demulcent and diuretic; its ashes are used in Spain in making glass.",FALSE
"Icequake (n.) The crash or concussion attending the breaking up of masses of ice, -- often due to contraction from extreme cold.",TRUE
Ich (pron.) I.,FALSE
"Ichneumon (n.) Any carnivorous mammal of the genus Herpestes, and family Viverridae. Numerous species are found in Asia and Africa. The Egyptian species(H. ichneumon), which ranges to Spain and Palestine, is noted for destroying the eggs and young of the crocodile as well as various snakes and lizards, and hence was considered sacred by the ancient Egyptians. The common species of India (H. griseus), known as the mongoose, has similar habits and is often domesticated. It is noted for killing the cobra.",TRUE
"Ichneumon (n.) Any hymenopterous insect of the family Ichneumonidae, of which several thousand species are known, belonging to numerous genera.",FALSE
"Ichneumonidan (a.) Of or pertaining to the Ichneumonidae, or ichneumon flies.",TRUE
Ichneumonidan (n.) One of the Ichneumonidae.,FALSE
Ichneumonides (n. pl.) The ichneumon flies.,TRUE
"Ichnite (n.) A fossil footprint; as, the ichnites in the Triassic sandstone.",FALSE
Ichnographic (a.) Alt. of Ichnographical,TRUE
Ichnographical (a.) Of or pertaining to ichonography; describing a ground plot.,FALSE
"Ichnography (n.) A horizontal section of a building or other object, showing its true dimensions according to a geometric scale; a ground plan; a map; also, the art of making such plans.",TRUE
Ichnolite (n.) A fossil footprint; an ichnite.,FALSE
Ichnolithology (n.) Same as Ichnology.,TRUE
Ichnological (a.) Of or pertaining to ichnology.,FALSE
Ichnology (n.) The branch of science which treats of fossil footprints.,TRUE
Ichnoscopy (n.) The search for the traces of anything.,FALSE
Ichor (n.) An ethereal fluid that supplied the place of blood in the veins of the gods.,TRUE
"Ichor (n.) A thin, acrid, watery discharge from an ulcer, wound, etc.",FALSE
Ichorhaemia (n.) Infection of the blood with ichorous or putrid substances.,TRUE
Ichorous (a.) Of or like ichor; thin; watery; serous; sanious.,FALSE
Ichthidin (n.) A substance from the egg yolk of osseous fishes.,TRUE
"Ichthin (n.) A nitrogenous substance resembling vitellin, present in the egg yolk of cartilaginous fishes.",FALSE
Ichthulin (n.) A substance from the yolk of salmon's egg.,TRUE
"Ichthus (n.) In early Christian and eccesiastical art, an emblematic fish, or the Greek word for fish, which combined the initials of the Greek words /, /, / /, /, Jesus, Christ, Son of God, Savior.",FALSE
"Ichthyic (a.) Like, or pertaining to, fishes.",TRUE
Ichthyocol (n.) Alt. of Ichthyocolla,FALSE
Ichthyocolla (n.) Fish glue; isinglass; a glue prepared from the sounds of certain fishes.,TRUE
Ichthyocoprolite (n.) Fossil dung of fishes.,FALSE
Ichthyodorulite (n.) One of the spiny plates foundon the back and tail of certain skates.,TRUE
Ichthyography (n.) A treatise on fishes.,FALSE
Ichthyoid (a.) Alt. of Ichthyoidal,TRUE
Ichthyoidal (a.) Somewhat like a fish; having some of the characteristics of fishes; -- said of some amphibians.,FALSE
"Ichthyolatry (n.) Worship of fishes, or of fish-shaped idols.",TRUE
"Ichthyolite (n.) A fossil fish, or fragment of a fish.",FALSE
Ichthyologic (a.) Alt. of Ichthyological,TRUE
Ichthyological (a.) Of or pertaining to ichthyology.,FALSE
"Ichthyologist (n.) One versed in, or who studies, ichthyology.",TRUE
"Ichthyology (n.) The natural history of fishes; that branch of zoology which relates to fishes, including their structure, classification, and habits.",FALSE
Ichthyomancy (n.) Divination by the heads or the entrails of fishes.,TRUE
Ichthyomorpha (n. pl.) The Urodela.,FALSE
Ichthyomorphic (a.) Alt. of Ichthyomorphous,TRUE
"Ichthyomorphous (a.) Fish-shaped; as, the ichthyomorphic idols of ancient Assyria.",FALSE
"Ichthyophagist (n.) One who eats, or subsists on, fish.",TRUE
"Ichthyophagous (a.) Eating, or subsisting on, fish.",FALSE
"Ichthyohagy (n.) The practice of eating, or living upon, fish.",TRUE
Ichthyophthalmite (n.) See Apophyllite.,FALSE
"Ichthyophthira (n. pl.) A division of copepod crustaceans, including numerous species parasitic on fishes.",TRUE
"Ichthyopsida (n. pl.) A grand division of the Vertebrata, including the Amphibia and Fishes.",FALSE
Ichthyopterygia (n. pl.) See Ichthyosauria.,TRUE
"Ichthyopterygium (n.) The typical limb, or lateral fin, of fishes.",FALSE
"Ichthyornis (n.) An extinct genus of toothed birds found in the American Cretaceous formation. It is remarkable for having biconcave vertebrae, and sharp, conical teeth set in sockets. Its wings were well developed. It is the type of the order Odontotormae.",TRUE
Ichthyosaur (n.) One of the Ichthyosaura.,FALSE
"Ichthyosauria (n. pl.) An extinct order of marine reptiles, including Ichthyosaurus and allied forms; -- called also Ichthyopterygia. They have not been found later than the Cretaceous period.",TRUE
Ichthyosaurian (a.) Of or pertaining to the Ichthyosauria.,FALSE
Ichthyosaurian (n.) One of the Ichthyosauria.,TRUE
Ichthyosauri (pl. ) of Ichthyosaurus,FALSE
"Ichthyosaurus (n.) An extinct genus of marine reptiles; -- so named from their short, biconcave vertebrae, resembling those of fishes. Several species, varying in length from ten to thirty feet, are known from the Liassic, Oolitic, and Cretaceous formations.",TRUE
"Ichthyosis (n.) A disease in which the skin is thick, rough, and scaly; -- called also fishskin.",FALSE
Ichthyotomist (n.) One skilled in ichthyotomy.,TRUE
Ichthyoomy (n.) The anatomy or dissection of fishes.,FALSE
Ichthys (n.) Same as Ichthus.,TRUE
"Icicle (n.) A pendent, and usually conical, mass of ice, formed by freezing of dripping water; as, the icicles on the eaves of a house.",FALSE
Icicled (a.) Having icicles attached.,TRUE
Icily (adv.) In an icy manner; coldly.,FALSE
Iciness (n.) The state or quality of being icy or very cold; frigidity.,TRUE
"Icing (n.) A coating or covering resembling ice, as of sugar and milk or white of egg; frosting.",FALSE
Ickle (n.) An icicle.,TRUE
Icon (n.) An image or representation; a portrait or pretended portrait.,FALSE
"Iconical (a.) Pertaining to, or consisting of, images, pictures, or representations of any kind.",TRUE
"Iconism (n.) The formation of a figure, representation, or semblance; a delineation or description.",FALSE
Iconize (v. t.) To form an image or likeness of.,TRUE
Iconoclasm (n.) The doctrine or practice of the iconoclasts; image breaking.,FALSE
Iconoclast (n.) A breaker or destroyer of images or idols; a determined enemy of idol worship.,TRUE
Iconoclast (n.) One who exposes or destroys impositions or shams; one who attacks cherished beliefs; a radical.,FALSE
"Iconoclastic (a.) Of or pertaining to the iconoclasts, or to image breaking.",TRUE
Iconodule (n.) Alt. of Iconodulist,FALSE
Iconodulist (n.) One who serves images; -- opposed to an iconoclast.,TRUE
Iconographer (n.) A maker of images.,FALSE
Iconographic (a.) Of or pertaining to iconography.,TRUE
"Iconographic (a.) Representing by means of pictures or diagrams; as, an icongraphic encyclopaedia.",FALSE
"Iconography (n.) The art or representation by pictures or images; the description or study of portraiture or representation, as of persons; as, the iconography of the ancients.",TRUE
Iconography (n.) The study of representative art in general.,FALSE
Iconolater (n.) One who worships images.,TRUE
"Iconolatry (n.) The worship of images as symbols; -- distinguished from idolatry, the worship of images themselves.",FALSE
Iconology (n.) The discussion or description of portraiture or of representative images. Cf. Iconography.,TRUE
Iconomachy (n.) Hostility to images as objects of worship.,FALSE
Iconomical (a.) Opposed to pictures or images as objects of worship.,TRUE
"Iconophilist (n.) A student, or lover of the study, of iconography.",FALSE
Icosahedral (a.) Having twenty equal sides or faces.,TRUE
Icosahedron (n.) A solid bounded by twenty sides or faces.,FALSE
"Icosandria (n. pl.) A Linnaean class of plants, having twenty or more stamens inserted in the calyx.",TRUE
Icosandrian (a.) Alt. of Icosandrous,FALSE
Icosandrous (a.) Pertaining to the class Icosandria; having twenty or more stamens inserted in the calyx.,TRUE
Icositetrahedron (n.) A twenty-four-sided solid; a tetragonal trisoctahedron or trapezohedron.,FALSE
"-ics () A suffix used in forming the names of certain sciences, systems, etc., as acoustics, mathematics, dynamics, statistics, politics, athletics.",TRUE
Icteric (n.) A remedy for the jaundice.,FALSE
Icteric (a.) Alt. of Icterical,TRUE
"Icterical (a.) Pertaining to, or affected with, jaundice.",FALSE
Icterical (a.) Good against the jaundice.,TRUE
Icteritious (a.) Alt. of Icteritous,FALSE
Icteritous (a.) Yellow; of the color of the skin when it is affected by the jaundice.,TRUE
"Icteroid (a.) Of a tint resembling that produced by jaundice; yellow; as, an icteroid tint or complexion.",FALSE
Icterus (a.) The jaundice.,TRUE
"Ictic (a.) Pertaining to, or caused by, a blow; sudden; abrupt.",FALSE
Ictus (n.) The stress of voice laid upon accented syllable of a word. Cf. Arsis.,TRUE
"Ictus (n.) A stroke or blow, as in a sunstroke, the sting of an insect, pulsation of an artery, etc.",FALSE
"Icy (superl.) Pertaining to, resembling, or abounding in, ice; cold; frosty.",TRUE
"Icy (superl.) Characterized by coldness, as of manner, influence, etc.; chilling; frigid; cold.",FALSE
Icy-pearled (a.) Spangled with ice.,TRUE
I'd () A contraction from I would or I had.,FALSE
"Id (n.) A small fresh-water cyprinoid fish (Leuciscus idus or Idus idus) of Europe. A domesticated variety, colored like the goldfish, is called orfe in Germany.",TRUE
"Idalian (a.) Of or pertaining to Idalium, a mountain city in Cyprus, or to Venus, to whom it was sacred.",FALSE
Ide (n.) Same as Id.,TRUE
"-ide () A suffix used to denote: (a) The nonmetallic, or negative, element or radical in a binary compound; as, oxide, sulphide, chloride. (b) A compound which is an anhydride; as, glycolide, phthalide. (c) Any one of a series of derivatives; as, indogenide, glucoside, etc.",FALSE
Ideas (pl. ) of Idea,TRUE
"Idea (n.) The transcript, image, or picture of a visible object, that is formed by the mind; also, a similar image of any object whatever, whether sensible or spiritual.",FALSE
"Idea (n.) A general notion, or a conception formed by generalization.",TRUE
"Idea (n.) Hence: Any object apprehended, conceived, or thought of, by the mind; a notion, conception, or thought; the real object that is conceived or thought of.",FALSE
"Idea (n.) A belief, option, or doctrine; a characteristic or controlling principle; as, an essential idea; the idea of development.",TRUE
Idea (n.) A plan or purpose of action; intention; design.,FALSE
"Idea (n.) A rational conception; the complete conception of an object when thought of in all its essential elements or constituents; the necessary metaphysical or constituent attributes and relations, when conceived in the abstract.",TRUE
"Idea (n.) A fiction object or picture created by the imagination; the same when proposed as a pattern to be copied, or a standard to be reached; one of the archetypes or patterns of created things, conceived by the Platonists to have excited objectively from eternity in the mind of the Deity.",FALSE
"Ideal (a.) Existing in idea or thought; conceptional; intellectual; mental; as, ideal knowledge.",TRUE
"Ideal (a.) Reaching an imaginary standard of excellence; fit for a model; faultless; as, ideal beauty.",FALSE
Ideal (a.) Existing in fancy or imagination only; visionary; unreal.,TRUE
"Ideal (a.) Teaching the doctrine of idealism; as, the ideal theory or philosophy.",FALSE
Ideal (a.) Imaginary.,TRUE
"Ideal (n.) A mental conception regarded as a standard of perfection; a model of excellence, beauty, etc.",FALSE
Idealess (a.) Destitute of an idea.,TRUE
Idealism (n.) The quality or state of being ideal.,FALSE
Idealism (n.) Conception of the ideal; imagery.,TRUE
"Idealism (n.) The system or theory that denies the existence of material bodies, and teaches that we have no rational grounds to believe in the reality of anything but ideas and their relations.",FALSE
Idealist (n.) One who idealizes; one who forms picturesque fancies; one given to romantic expectations.,TRUE
Idealist (n.) One who holds the doctrine of idealism.,FALSE
Idealistic (a.) Of or pertaining to idealists or their theories.,TRUE
Idealities (pl. ) of Ideality,FALSE
Ideality (n.) The quality or state of being ideal.,TRUE
Ideality (n.) The capacity to form ideals of beauty or perfection.,FALSE
Ideality (n.) The conceptive faculty.,TRUE
Idealization (n.) The act or process of idealizing.,FALSE
"Idealization (n.) The representation of natural objects, scenes, etc., in such a way as to show their most important characteristics; the study of the ideal.",TRUE
Idealized (imp. & p. p.) of Idealize,FALSE
Idealizing (p. pr. & vb. n.) of Idealize,TRUE
"Idealize (v. t.) To make ideal; to give an ideal form or value to; to attribute ideal characteristics and excellences to; as, to idealize real life.",FALSE
"Idealize (v. t.) To treat in an ideal manner. See Idealization, 2.",TRUE
Idealize (v. i.) To form ideals.,FALSE
Idealizer (n.) An idealist.,TRUE
Ideally (adv.) In an ideal manner; by means of ideals; mentally.,FALSE
"Idealogic (a.) Of or pertaining to an idealogue, or to idealization.",TRUE
Idealogue (n.) One given to fanciful ideas or theories; a theorist; a spectator.,FALSE
Ideat (n.) Alt. of Ideate,TRUE
Ideate (n.) The actual existence supposed to correspond with an idea; the correlate in real existence to the idea as a thought or existence.,FALSE
Ideate (v. t.) To form in idea; to fancy.,TRUE
Ideate (v. t.) To apprehend in thought so as to fix and hold in the mind; to memorize.,FALSE
Ideation (n.) The faculty or capacity of the mind for forming ideas; the exercise of this capacity; the act of the mind by which objects of sense are apprehended and retained as objects of thought.,TRUE
"Ideational (a.) Pertaining to, or characterized by, ideation.",FALSE
Idem (pron. / adj.) The same; the same as above; -- often abbreviated id.,TRUE
Identic (a.) Identical.,FALSE
"Identical (a.) The same; the selfsame; the very same; not different; as, the identical person or thing.",TRUE
"Identical (a.) Uttering sameness or the same truth; expressing in the predicate what is given, or obviously implied, in the subject; tautological.",FALSE
Identically (adv.) In an identical manner; with respect to identity.,TRUE
Identicalness (n.) The quality or state of being identical; sameness.,FALSE
Identifiable (a.) Capable of being identified.,TRUE
"Identification (n.) The act of identifying, or proving to be the same; also, the state of being identified.",FALSE
Identified (imp. & p. p.) of Identify,TRUE
Identifying (p. pr. & vb. n.) of Identify,FALSE
Identify (v. t.) To make to be the same; to unite or combine in such a manner as to make one; to treat as being one or having the same purpose or effect; to consider as the same in any relation.,TRUE
"Identify (v. t.) To establish the identity of; to prove to be the same with something described, claimed, or asserted; as, to identify stolen property.",FALSE
"Identify (v. i.) To become the same; to coalesce in interest, purpose, use, effect, etc.",TRUE
"Identism (n.) The doctrine taught by Schelling, that matter and mind, and subject and object, are identical in the Absolute; -- called also the system / doctrine of identity.",FALSE
Identities (pl. ) of Identity,TRUE
"Identity (n.) The state or quality of being identical, or the same; sameness.",FALSE
"Identity (n.) The condition of being the same with something described or asserted, or of possessing a character claimed; as, to establish the identity of stolen goods.",TRUE
Identity (n.) An identical equation.,FALSE
"Ideo- () A combining form from the Gr. /, an idea.",TRUE
Ideogenical (a.) Of or relating to ideology.,FALSE
Ideogeny (n.) The science which treats of the origin of ideas.,TRUE
"Ideogram (n.) An original, pictorial element of writing; a kind of hieroglyph expressing no sound, but only an idea.",FALSE
"Ideogram (n.) A symbol used for convenience, or for abbreviation; as, 1, 2, 3, +, -, /, $, /, etc.",TRUE
Ideogram (n.) A phonetic symbol; a letter.,FALSE
Ideograph (n.) Same as Ideogram.,TRUE
Ideographic (a.) Alt. of Ideographical,FALSE
"Ideographical (a.) Of or pertaining to an ideogram; representing ideas by symbols, independently of sounds; as, 9 represents not the word ""nine,"" but the idea of the number itself.",TRUE
"Ideographics (n.) The system of writing in ideographic characters; also, anything so written.",FALSE
"Ideography (n.) The representation of ideas independently of sounds, or in an ideographic manner, as sometimes is done in shorthand writing, etc.",TRUE
Ideological (a.) Of or pertaining to ideology.,FALSE
"Ideologist (n.) One who treats of ideas; one who theorizes or idealizes; one versed in the science of ideas, or who advocates the doctrines of ideology.",TRUE
Ideology (n.) The science of ideas.,FALSE
Ideology (n.) A theory of the origin of ideas which derives them exclusively from sensation.,TRUE
Ideo-motion (n.) An ideo-motor movement.,FALSE
"Ideo-motor (a.) Applied to those actions, or muscular movements, which are automatic expressions of dominant ideas, rather than the result of distinct volitional efforts, as the act of expressing the thoughts in speech, or in writing, while the mind is occupied in the composition of the sentence.",TRUE
"Ides (n. pl.) The fifteenth day of March, May, July, and October, and the thirteenth day of the other months.",FALSE
"Idio- () A combining form from the Greek /, meaning private, personal, peculiar, distinct.",TRUE
"Idioblast (n.) An individual cell, differing greatly from its neighbours in regard to size, structure, or contents.",FALSE
Idiocrasis (n.) Idiocracy.,TRUE
Idiocrasies (pl. ) of Idiocracy,FALSE
"Idiocracy (n.) Peculiarity of constitution; that temperament, or state of constitution, which is peculiar to a person; idiosyncrasy.",TRUE
Idiocratic (a.) Alt. of Idiocratical,FALSE
Idiocratical (a.) Peculiar in constitution or temperament; idiosyncratic.,TRUE
"Idiocy (n.) The condition or quality of being an idiot; absence, or marked deficiency, of sense and intelligence.",FALSE
Idiocyclophanous (a.) Same as Idiophanous.,TRUE
Idioelectric (a.) Electric by virtue of its own peculiar properties; capable of becoming electrified by friction; -- opposed to anelectric.,FALSE
Idioelectric (n.) An idioelectric substance.,TRUE
Idiograph (n.) A mark or signature peculiar to an individual; a trade-mark.,FALSE
Idiographic (a.) Alt. of Idiographical,TRUE
Idiographical (a.) Of or pertaining to an idiograph.,FALSE
Idiolatry (n.) Self-worship; excessive self-esteem.,TRUE
Idiom (n.) The syntactical or structural form peculiar to any language; the genius or cast of a language.,FALSE
