"Improvise (v. t.) To compose, recite, or sing extemporaneously, especially in verse; to extemporize; also, to play upon an instrument, or to act, extemporaneously.",TRUE
"Improvise (v. t.) To bring about, arrange, or make, on a sudden, or without previous preparation.",FALSE
"Improvise (v. t.) To invent, or provide, offhand, or on the spur of the moment; as, he improvised a hammer out of a stone.",TRUE
"Improvise (v. i.) To produce or render extemporaneous compositions, especially in verse or in music, without previous preparation; hence, to do anything offhand.",FALSE
Improviser (n.) One who improvises.,TRUE
Improvision (n.) Improvidence.,FALSE
Improviso (a.) Not prepared or mediated beforehand; extemporaneous.,TRUE
Improvvisatori (pl. ) of Improvvisatore,FALSE
Improvvisatore (n.) One who composes and sings or recites rhymes and short poems extemporaneously.,TRUE
Improvvisatrici (pl. ) of Improvvisatrice,FALSE
Improvvisatrice (n.) A female improvvisatore.,TRUE
"Imprudence (n.) The quality or state of being imprudent; want to caution, circumspection, or a due regard to consequences; indiscretion; inconsideration; reshness; also, an imprudent act; as, he was guilty of an imprudence.",FALSE
Imprudent (a.) Not prudent; wanting in prudence or discretion; indiscreet; injudicious; not attentive to consequence; improper.,TRUE
Impuberal (a.) Not having arrived at puberty; immature.,FALSE
"Impuberty (n.) The condition of not having reached puberty, or the age of ability to reproduce one's species; want of age at which the marriage contract can be legally entered into.",TRUE
"Impudence (n.) The quality of being impudent; assurance, accompanied with a disregard of the presence or opinions of others; shamelessness; forwardness; want of modesty.",FALSE
Impudency (n.) Impudence.,TRUE
"Impudent (a.) Bold, with contempt or disregard; unblushingly forward; impertinent; wanting modesty; shameless; saucy.",FALSE
Impudently (adv.) In an impudent manner; with unbecoming assurance; shamelessly.,TRUE
Impudicity (n.) Immodesty.,FALSE
Impugned (imp. & p. p.) of Impugn,TRUE
Impugning (p. pr. & vb. n.) of Impugn,FALSE
Impugn (v. t.) To attack by words or arguments; to contradict; to assail; to call in question; to make insinuations against; to gainsay; to oppose.,TRUE
Impugnable (a.) Capable of being impugned; that may be gainsaid.,FALSE
Impugnation (n.) Act of impugning; opposition; attack.,TRUE
Impugner (n.) One who impugns.,FALSE
"Impugnment (n.) The act of impugning, or the state of being impugned.",TRUE
Impuissance (n.) Lack of power; inability.,FALSE
Impuissant (a.) Weak; impotent; feeble.,TRUE
"Impulse (n.) The act of impelling, or driving onward with sudden force; impulsion; especially, force so communicated as to produced motion suddenly, or immediately.",FALSE
Impulse (n.) The effect of an impelling force; motion produced by a sudden or momentary force.,TRUE
"Impulse (n.) The action of a force during a very small interval of time; the effect of such action; as, the impulse of a sudden blow upon a hard elastic body.",FALSE
"Impulse (n.) A mental force which simply and directly urges to action; hasty inclination; sudden motive; momentary or transient influence of appetite or passion; propension; incitement; as, a man of good impulses; passion often gives a violent impulse to the will.",TRUE
Impulse (v. t.) To impel; to incite.,FALSE
"Impulsion (n.) The act of impelling or driving onward, or the state of being impelled; the sudden or momentary agency of a body in motion on another body; also, the impelling force, or impulse.",TRUE
Impulsion (n.) Influence acting unexpectedly or temporarily on the mind; sudden motive or influence; impulse.,FALSE
Impulsive (a.) Having the power of driving or impelling; giving an impulse; moving; impellent.,TRUE
Impulsive (a.) Actuated by impulse or by transient feelings.,FALSE
"Impulsive (a.) Acting momentarily, or by impulse; not continuous; -- said of forces.",TRUE
Impulsive (n.) That which impels or gives an impulse; an impelling agent.,FALSE
Impulsively (adv.) In an impulsive manner.,TRUE
Impulsiveness (n.) The quality of being impulsive.,FALSE
"Impulsor (n.) One who, or that which, impels; an inciter.",TRUE
Impunctate (a.) Not punctuate or dotted.,FALSE
Impunctual (a.) Not punctual.,TRUE
"Impunctuality (n.) Neglect of, or failure in, punctuality.",FALSE
Impune (a.) Unpunished.,TRUE
Impunibly (adv.) Without punishment; with impunity.,FALSE
"Impunity (n.) Exemption or freedom from punishment, harm, or loss.",TRUE
Impuration (n.) Defilement; obscuration.,FALSE
"Impure (a.) Not pure; not clean; dirty; foul; filthy; containing something which is unclean or unwholesome; mixed or impregnated extraneous substances; adulterated; as, impure water or air; impure drugs, food, etc.",TRUE
Impure (a.) Defiled by sin or guilt; unholy; unhallowed; -- said of persons or things.,FALSE
"Impure (a.) Unchaste; lewd; unclean; obscene; as, impure language or ideas.",TRUE
Impure (a.) Not purified according to the ceremonial law of Moses; unclean.,FALSE
"Impure (a.) Not accurate; not idiomatic; as, impure Latin; an impure style.",TRUE
Impure (v. t.) To defile; to pollute.,FALSE
Impurely (adv.) In an impure manner.,TRUE
Impureness (n.) The quality or condition of being impure; impurity.,FALSE
Impurity (n.) The condition or quality of being impure in any sense; defilement; foulness; adulteration.,TRUE
"Impurity (n.) That which is, or which renders anything, impure; foul matter, action, language, etc.; a foreign ingredient.",FALSE
Impurity (n.) Want of ceremonial purity; defilement.,TRUE
Impurpled (imp. & p. p.) of Impurple,FALSE
Impurpling (p. pr. & vb. n.) of Impurple,TRUE
"Impurple (v. t.) To color or tinge with purple; to make red or reddish; to purple; as, a field impurpled with blood.",FALSE
Imputability (n.) The quality of being imputable; imputableness.,TRUE
Imputable (a.) That may be imputed; capable of being imputed; chargeable; ascribable; attributable; referable.,FALSE
Imputable (a.) Accusable; culpable.,TRUE
Imputableness (n.) Quality of being imputable.,FALSE
Imputably (adv.) By imputation.,TRUE
"Imputation () The act of imputing or charging; attribution; ascription; also, anything imputed or charged.",FALSE
Imputation () Charge or attribution of evil; censure; reproach; insinuation.,TRUE
"Imputation () A setting of something to the account of; the attribution of personal guilt or personal righteousness of another; as, the imputation of the sin of Adam, or the righteousness of Christ.",FALSE
Imputation () Opinion; intimation; hint.,TRUE
Imputative (a.) Transferred by imputation; that may be imputed.,FALSE
Imputed (imp. & p. p.) of Impute,TRUE
Imputing (p. pr. & vb. n.) of Impute,FALSE
"Impute (v. t.) To charge; to ascribe; to attribute; to set to the account of; to charge to one as the author, responsible originator, or possessor; -- generally in a bad sense.",TRUE
"Impute (v. t.) To adjudge as one's own (the sin or righteousness) of another; as, the righteousness of Christ is imputed to us.",FALSE
Impute (v. t.) To take account of; to consider; to regard.,TRUE
Imputer (n.) One who imputes.,FALSE
Imputrescible (a.) Not putrescible.,TRUE
"Imrigh (n.) A peculiar strong soup or broth, made in Scotland.",FALSE
"In- (prep.) A prefix from Eng. prep. in, also from Lat. prep. in, meaning in, into, on, among; as, inbred, inborn, inroad; incline, inject, intrude. In words from the Latin, in- regularly becomes il- before l, ir- before r, and im- before a labial; as, illusion, irruption, imblue, immigrate, impart. In- is sometimes used with an simple intensive force.",TRUE
"In- () An inseparable prefix, or particle, meaning not, non-, un- as, inactive, incapable, inapt. In- regularly becomes il- before l, ir- before r, and im- before a labial.",FALSE
-in () A suffix. See the Note under -ine.,TRUE
"In (prep.) The specific signification of in is situation or place with respect to surrounding, environment, encompassment, etc. It is used with verbs signifying being, resting, or moving within limits, or within circumstances or conditions of any kind conceived of as limiting, confining, or investing, either wholly or in part. In its different applications, it approaches some of the meanings of, and sometimes is interchangeable with, within, into, on, at, of, and among.",FALSE
"In (prep.) With reference to space or place; as, he lives in Boston; he traveled in Italy; castles in the air.",TRUE
"In (prep.) With reference to circumstances or conditions; as, he is in difficulties; she stood in a blaze of light.",FALSE
"In (prep.) With reference to a whole which includes or comprises the part spoken of; as, the first in his family; the first regiment in the army.",TRUE
"In (prep.) With reference to physical surrounding, personal states, etc., abstractly denoted; as, I am in doubt; the room is in darkness; to live in fear.",FALSE
"In (prep.) With reference to character, reach, scope, or influence considered as establishing a limitation; as, to be in one's favor.",TRUE
"In (prep.) With reference to movement or tendency toward a certain limit or environment; -- sometimes equivalent to into; as, to put seed in the ground; to fall in love; to end in death; to put our trust in God.",FALSE
"In (prep.) With reference to a limit of time; as, in an hour; it happened in the last century; in all my life.",TRUE
"In (adv.) Not out; within; inside. In, the preposition, becomes an adverb by omission of its object, leaving it as the representative of an adverbial phrase, the context indicating what the omitted object is; as, he takes in the situation (i. e., he comprehends it in his mind); the Republicans were in (i. e., in office); in at one ear and out at the other (i. e., in or into the head); his side was in (i. e., in the turn at the bat); he came in (i. e., into the house).",FALSE
"In (adv.) With privilege or possession; -- used to denote a holding, possession, or seisin; as, in by descent; in by purchase; in of the seisin of her husband.",TRUE
In (n.) One who is in office; -- the opposite of out.,FALSE
In (n.) A reentrant angle; a nook or corner.,TRUE
In (v. t.) To inclose; to take in; to harvest.,FALSE
"Inability (n.) The quality or state of being unable; lack of ability; want of sufficient power, strength, resources, or capacity.",TRUE
Inable (v. t.) See Enable.,FALSE
Inablement (n.) See Enablement.,TRUE
Inabstinence (n.) Want of abstinence; indulgence.,FALSE
Inabstracted (a.) Not abstracted.,TRUE
Inabusively (adv.) Without abuse.,FALSE
Inaccessibility (n.) The quality or state of being inaccessible; inaccessibleness.,TRUE
"Inaccessible (a.) Not accessible; not to be reached, obtained, or approached; as, an inaccessible rock, fortress, document, prince, etc.",FALSE
Inaccordant (a.) Not accordant; discordant.,TRUE
Inaccuracies (pl. ) of Inaccuracy,FALSE
Inaccuracy (n.) The quality of being inaccurate; want of accuracy or exactness.,TRUE
"Inaccuracy (n.) That which is inaccurate or incorrect; mistake; fault; defect; error; as, in inaccuracy in speech, copying, calculation, etc.",FALSE
"Inaccurate (a.) Not accurate; not according to truth; inexact; incorrect; erroneous; as, in inaccurate man, narration, copy, judgment, calculation, etc.",TRUE
Inaccurately (adv.) In an inaccurate manner; incorrectly; inexactly.,FALSE
Inacquaintance (a.) Want of acquaintance.,TRUE
Inacquiescent (a.) Not acquiescent or acquiescing.,FALSE
Inaction (n.) Want of action or activity; forbearance from labor; idleness; rest; inertness.,TRUE
"Inactive (a.) Not active; having no power to move; that does not or can not produce results; inert; as, matter is, of itself, inactive.",FALSE
"Inactive (a.) Not disposed to action or effort; not diligent or industrious; not busy; idle; as, an inactive officer.",TRUE
"Inactive (a.) Not active; inert; esp., not exhibiting any action or activity on polarized light; optically neutral; -- said of isomeric forms of certain substances, in distinction from other forms which are optically active; as, racemic acid is an inactive tartaric acid.",FALSE
Inactively (adv.) In an inactive manner.,TRUE
"Inactivity (n.) The state or quality of being inactive; inertness; as, the inactivity of matter.",FALSE
Inactivity (n.) Idleness; habitual indisposition to action or exertion; want of energy; sluggishness.,TRUE
"Inactose (n.) A variety of sugar, found in certain plants. It is optically inactive.",FALSE
Inactuate (v. t.) To put in action.,TRUE
Inactuation (n.) Operation.,FALSE
Inadaptation (n.) Want of adaptation; unsuitableness.,TRUE
Inadequacy (n.) The quality or state of being inadequate or insufficient; defectiveness; insufficiency; inadequateness.,FALSE
"Inadequate (a.) Not adequate; unequal to the purpose; insufficient; deficient; as, inadequate resources, power, conceptions, representations, etc.",TRUE
Inadequation (n.) Want of exact correspondence.,FALSE
Inadherent (a.) Not adhering.,TRUE
Inadherent (a.) Free; not connected with the other organs.,FALSE
Inadhesion (n.) Want of adhesion.,TRUE
"Inadmissibility (n.) The state or quality of being inadmissible, or not to be received.",FALSE
"Inadmissible (a.) Not admissible; not proper to be admitted, allowed, or received; as, inadmissible testimony; an inadmissible proposition, or explanation.",TRUE
#NAME?,FALSE
#NAME?,TRUE
Inadvertence (n.) Alt. of Inadvertency,FALSE
"Inadvertency (n.) The quality of being inadvertent; lack of heedfulness or attentiveness; inattention; negligence; as, many mistakes proceed from inadvertence.",TRUE
"Inadvertency (n.) An effect of inattention; a result of carelessness; an oversight, mistake, or fault from negligence.",FALSE
Inadvertent (a.) Not turning the mind to a matter; heedless; careless; negligent; inattentive.,TRUE
Inadvisable (a.) Not advisable.,FALSE
Inaffability (n.) Want of affability or sociability; reticence.,TRUE
Inaffable (a.) Not affable; reserved in social intercourse.,FALSE
Inaffectation (n.) Freedom from affectation; naturalness.,TRUE
Inaffected (a.) Unaffected.,FALSE
Inaidable (a.) Incapable of being assisted; helpless.,TRUE
Inalienability (n.) The quality or state of being inalienable.,FALSE
"Inalienable (a.) Incapable of being alienated, surrendered, or transferred to another; not alienable; as, in inalienable birthright.",TRUE
Inalienableness (n.) The quality or state of being inalienable; inalienability.,FALSE
"Inalienably (adv.) In a manner that forbids alienation; as, rights inalienably vested.",TRUE
Inalimental (a.) Affording no aliment or nourishment.,FALSE
Inalterability (n.) The quality of being unalterable or unchangeable; permanence.,TRUE
Inalterable (a.) Not alterable; incapable of being altered or changed; unalterable.,FALSE
Inamiable (a.) Unamiable.,TRUE
Inamissible (a.) Incapable of being lost.,FALSE
Inamorata (n.) A woman in love; a mistress.,TRUE
Inamorate (a.) Enamored.,FALSE
Inamoratos (pl. ) of Inamorato,TRUE
Inamorato (n.) A male lover.,FALSE
Inamovable (a.) Not amovable or removable.,TRUE
"In-and-in (n.) An old game played with four dice. In signified a doublet, or two dice alike; in-and-in, either two doubles, or the four dice alike.",FALSE
In and an (a. & adv.) Applied to breeding from a male and female of the same parentage. See under Breeding.,TRUE
Inane (a.) Without contents; empty; void of sense or intelligence; purposeless; pointless; characterless; useless.,FALSE
Inane (n.) That which is void or empty.,TRUE
Inangular (a.) Not angular.,FALSE
Inaniloquent (a.) Alt. of Inaniloquous,TRUE
Inaniloquous (a.) Given to talking inanely; loquacious; garrulous.,FALSE
Inanimate (v. t.) To animate.,TRUE
"Inanimate (a.) Not animate; destitute of life or spirit; lifeless; dead; inactive; dull; as, stones and earth are inanimate substances.",FALSE
Inanimated (a.) Destitute of life; lacking animation; unanimated.,TRUE
Inanimateness (n.) The quality or state of being inanimate.,FALSE
Inanimation (n.) Want of animation; lifeless; dullness.,TRUE
Inanimation (n.) Infusion of life or vigor; animation; inspiration.,FALSE
Inanitiate (v. t.) To produce inanition in; to exhaust for want of nourishment.,TRUE
Inanitiation (n.) Inanition.,FALSE
"Inanition (n.) The condition of being inane; emptiness; want of fullness, as in the vessels of the body; hence, specifically, exhaustion from want of food, either from partial or complete starvation, or from a disorder of the digestive apparatus, producing the same result.",TRUE
Inanities (pl. ) of Inanity,FALSE
Inanity (n.) Inanition; void space; vacuity; emptiness.,TRUE
Inanity (n.) Want of seriousness; aimlessness; frivolity.,FALSE
"Inanity (n.) An inane, useless thing or pursuit; a vanity; a silly object; -- chiefly in pl.; as, the inanities of the world.",TRUE
Inantherate (a.) Not bearing anthers; -- said of sterile stamens.,FALSE
"In antis () Between antae; -- said of a portico in classical style, where columns are set between two antae, forming the angles of the building. See Anta.",TRUE
Inapathy (n.) Sensibility; feeling; -- opposed to apathy.,FALSE
Inappealable (a.) Not admitting of appeal; not appealable.,TRUE
Inappeasable (a.) Incapable of being appeased or satisfied; unappeasable.,FALSE
Inappellability (n.) The quality of being inappellable; finality.,TRUE
Inappellable (a.) Inappealable; final.,FALSE
Inappetence (n.) Alt. of Inappetency,TRUE
Inappetency (n.) Want of appetency; want of desire.,FALSE
Inapplicability (n.) The quality of being inapplicable; unfitness; inapplicableness.,TRUE
"Inapplicable (a.) Not applicable; incapable of being applied; not adapted; not suitable; as, the argument is inapplicable to the case.",FALSE
"Inapplication (n.) Want of application, attention, or diligence; negligence; indolence.",TRUE
Inapposite (a.) Not apposite; not fit or suitable; not pertinent.,FALSE
Inappreciable (a.) Not appreciable; too small to be perceived; incapable of being duly valued or estimated.,TRUE
Inappreciation (n.) Want of appreciation.,FALSE
Inapprehensible (a.) Not apprehensible; unintelligible; inconceivable.,TRUE
Inapprehension (n.) Want of apprehension.,FALSE
Inapprehensive (a.) Not apprehensive; regardless; unconcerned.,TRUE
Inapproachable (a.) Not approachable; unapproachable; inaccessible; unequaled.,FALSE
Inappropriate (a.) Not instrument (to); not appropriate; unbecoming; unsuitable; not specially fitted; -- followed by to or for.,TRUE
Inapt (a.) Unapt; not apt; unsuitable; inept.,FALSE
Inaptitude (n.) Want of aptitude.,TRUE
"Inaquate (a.) Embodied in, or changed into, water.",FALSE
Inaquation (n.) The state of being inaquate.,TRUE
Inarable (a.) Not arable.,FALSE
Inarched (imp. & p. p.) of Inarch,TRUE
Inarching (p. pr. & vb. n.) of Inarch,FALSE
"Inarch (v. t.) To graft by uniting, as a scion, to a stock, without separating either from its root before the union is complete; -- also called to graft by approach.",TRUE
Inarching (n.) A method of ingrafting. See Inarch.,FALSE
"Inarticulate (a.) Not uttered with articulation or intelligible distinctness, as speech or words.",TRUE
"Inarticulate (a.) Not jointed or articulated; having no distinct body segments; as, an inarticulate worm.",FALSE
Inarticulate (a.) Without a hinge; -- said of an order (Inarticulata or Ecardines) of brachiopods.,TRUE
Inarticulate (a.) Incapable of articulating.,FALSE
Inarticulated (a.) Not articulated; not jointed or connected by a joint.,TRUE
Inarticulately (adv.) In an inarticulate manner.,FALSE
Inarticulateness (n.) The state or quality of being inarticulate.,TRUE
Inarticulation (n.) Inarticulateness.,FALSE
"Inartificial (a.) Not artificial; not made or elaborated by art; natural; simple; artless; as, an inartificial argument; an inartificial character.",TRUE
"Inasmuch (adv.) In like degree; in like manner; seeing that; considering that; since; -- followed by as. See In as much as, under In, prep.",FALSE
"Inattention (n.) Want of attention, or failure to pay attention; disregard; heedlessness; neglect.",TRUE
"Inattentive (a.) Not attentive; not fixing the mind on an object; heedless; careless; negligent; regardless; as, an inattentive spectator or hearer; an inattentive habit.",FALSE
Inaudibility (n.) The quality of being inaudible; inaudibleness.,TRUE
Inaudible (a.) Not audible; incapable of being heard; silent.,FALSE
Inaugur (v. t.) To inaugurate.,TRUE
"Inaugural (a.) Pertaining to, or performed or pronounced at, an inauguration; as, an inaugural address; the inaugural exercises.",FALSE
Inaugural (n.) An inaugural address.,TRUE
Inaugurate (a.) Invested with office; inaugurated.,FALSE
Inaugurated (imp. & p. p.) of Inaugurate,TRUE
Inaugurating (p. pr. & vb. n.) of Inaugurate,FALSE
"Inaugurate (v. t.) To introduce or induct into an office with suitable ceremonies or solemnities; to invest with power or authority in a formal manner; to install; as, to inaugurate a president; to inaugurate a king.",TRUE
"Inaugurate (v. t.) To cause to begin, esp. with formality or solemn ceremony; hence, to set in motion, action, or progress; to initiate; -- used especially of something of dignity or worth or public concern; as, to inaugurate a new era of things, new methods, etc.",FALSE
"Inaugurate (v. t.) To celebrate the completion of, or the first public use of; to dedicate, as a statue.",TRUE
Inaugurate (v. t.) To begin with good omens.,FALSE
"Inauguration (n.) The act of inuagurating, or inducting into office with solemnity; investiture by appropriate ceremonies.",TRUE
"Inauguration (n.) The formal beginning or initiation of any movement, course of action, etc.; as, the inauguration of a new system, a new condition, etc.",FALSE
Inaugurator (n.) One who inaugurates.,TRUE
"Inauguratory (a.) Suitable for, or pertaining to, inauguration.",FALSE
Inaurate (a.) Covered with gold; gilded.,TRUE
Inaurate (v. t.) To cover with gold; to gild.,FALSE
Inauration (n.) The act or process of gilding or covering with gold.,TRUE
Inauspicate (a.) Inauspicious.,FALSE
Inauspicious (a.) Not auspicious; ill-omened; unfortunate; unlucky; unfavorable.,TRUE
Inauthoritative (a.) Without authority; not authoritative.,FALSE
Inbarge (v. t. & i.) To embark; to go or put into a barge.,TRUE
Inbeaming (n.) Shining in.,FALSE
Inbeing (n.) Inherence; inherent existence.,TRUE
Inbind (v. t.) To inclose.,FALSE
Inblown (a.) Blown in or into.,TRUE
"Inboard (a. & adv.) Inside the line of a vessel's bulwarks or hull; the opposite of outboard; as, an inboard cargo; haul the boom inboard.",FALSE
"Inboard (a. & adv.) From without inward; toward the inside; as, the inboard stroke of a steam engine piston, the inward or return stroke.",TRUE
"Inborn (a.) Born in or with; implanted by nature; innate; as, inborn passions.",FALSE
Inbreak (n.) Alt. of Inbreaking,TRUE
Inbreaking (n.) A breaking in; inroad; invasion.,FALSE
Inbreathed (imp. & p. p.) of Inbreathe,TRUE
Inbreathing (p. pr. & vb. n.) of Inbreathe,FALSE
Inbreathe (v. t.) To infuse by breathing; to inspire.,TRUE
"Inbred (a.) Bred within; innate; as, inbred worth.",FALSE
Inbred (imp. & p. p.) of Inbreed,TRUE
Inbreeding (p. pr. & vb. n.) of Inbreed,FALSE
Inbreed (v. t.) To produce or generate within.,TRUE
"Inbreed (v. t.) To breed in and in. See under Breed, v. i.",FALSE
Inburning (a.) Burning within.,TRUE
Inburnt (a.) Burnt in; ineffaceable.,FALSE
Inburst (n.) A bursting in or into.,TRUE
Inc (n.) A Japanese measure of length equal to about two and one twelfth yards.,FALSE
"Inca (n.) An emperor or monarch of Peru before, or at the time of, the Spanish conquest; any member of this royal dynasty, reputed to have been descendants of the sun.",TRUE
"Inca (n.) The people governed by the Incas, now represented by the Quichua tribe.",FALSE
Incaged (imp. & p. p.) of Incage,TRUE
Incaging (p. pr. & vb. n.) of Incage,FALSE
"Incage (v. t.) To confine in, or as in, a cage; to coop up.",TRUE
"Incagement (n.) Confinement in, or as in, cage.",FALSE
Incalculability (n.) The quality or state of being incalculable.,TRUE
Incalculable (a.) Not capable of being calculated; beyond calculation; very great.,FALSE
"Incalescence (n.) The state of being incalescent, or of growing warm.",TRUE
Incalescency (n.) Incalescence.,FALSE
Incalescent (a.) Growing warm; increasing in heat.,TRUE
"Incameration (n.) The act or process of uniting lands, rights, or revenues, to the ecclesiastical chamber, i. e., to the pope's domain.",FALSE
Incan (a.) Of or pertaining to the Incas.,TRUE
"Incandescence (n.) A white heat, or the glowing or luminous whiteness of a body caused by intense heat.",FALSE
"Incandescent (a.) White, glowing, or luminous, with intense heat; as, incandescent carbon or platinum; hence, clear; shining; brilliant.",TRUE
Incanescent (a.) Becoming hoary or gray; canescent.,FALSE
Incanous (a.) Hoary with white pubescence.,TRUE
"Incantation (n.) The act or process of using formulas sung or spoken, with occult ceremonies, for the purpose of raising spirits, producing enchantment, or affecting other magical results; enchantment.",FALSE
Incantation (n.) A formula of words used as above.,TRUE
Incantatory (a.) Dealing by enchantment; magical.,FALSE
Incanting (a.) Enchanting.,TRUE
"Incanton (v. t.) To unite to, or form into, a canton or separate community.",FALSE
Incapability (n.) The quality of being incapable; incapacity.,TRUE
"Incapability (n.) Want of legal qualifications, or of legal power; as, incapability of holding an office.",FALSE
"Incapable (a.) Wanting in ability or qualification for the purpose or end in view; not large enough to contain or hold; deficient in physical strength, mental or moral power, etc.; not capable; as, incapable of holding a certain quantity of liquid; incapable of endurance, of comprehension, of perseverance, of reform, etc.",TRUE
"Incapable (a.) Not capable of being brought to do or perform, because morally strong or well disposed; -- used with reference to some evil; as, incapable of wrong, dishonesty, or falsehood.",FALSE
"Incapable (a.) Not in a state to receive; not receptive; not susceptible; not able to admit; as, incapable of pain, or pleasure; incapable of stain or injury.",TRUE
