"Infernal (a.) Of or pertaining to, resembling, or inhabiting, hell; suitable for hell, or to the character of the inhabitants of hell; hellish; diabolical; as, infernal spirits, or conduct.",FALSE
"Infernal (n.) An inhabitant of the infernal regions; also, the place itself.",TRUE
Infernally (adv.) In an infernal manner; diabolically.,FALSE
Inferobranchian (n.) One of the Inferobranchiata.,TRUE
"Inferobranchiata (n. pl.) A suborder of marine gastropod mollusks, in which the gills are between the foot and the mantle.",FALSE
"Inferobranchiate (a.) Having the gills on the sides of the body, under the margin of the mantle; belonging to the Inferobranchiata.",TRUE
Inferrible (a.) Inferable.,FALSE
"Infertile (a.) Not fertile; not productive; barren; sterile; as, an infertile soil.",TRUE
Infertilely (adv.) In an infertile manner.,FALSE
Infertility (n.) The state or quality of being infertile; unproductiveness; barrenness.,TRUE
Infest (v. t.) Mischievous; hurtful; harassing.,FALSE
Infested (imp. & p. p.) of Infest,TRUE
Infesting (p. pr. & vb. n.) of Infest,FALSE
"Infest (v. t.) To trouble greatly by numbers or by frequency of presence; to disturb; to annoy; to frequent and molest or harass; as, fleas infest dogs and cats; a sea infested with pirates.",TRUE
Infesttation (n.) The act of infesting or state of being infested; molestation; vexation; annoyance.,FALSE
"Infester (n.) One who, or that which, infests.",TRUE
Infestive (a.) Having no mirth; not festive or merry; dull; cheerless; gloomy; forlorn.,FALSE
"Infestivity (n.) Want of festivity, cheerfulness, or mirth; dullness; cheerlessness.",TRUE
Infestuous (a.) Mischievous; harmful; dangerous.,FALSE
Infeudation (n.) The act of putting one in possession of an estate in fee.,TRUE
Infeudation (n.) The granting of tithes to laymen.,FALSE
"Infibulation (n.) The act of clasping, or fastening, as with a buckle or padlock.",TRUE
"Infibulation (n.) The act of attaching a ring, clasp, or frame, to the genital organs in such a manner as to prevent copulation.",FALSE
"Infidel (a.) Not holding the faith; -- applied esp. to one who does not believe in the inspiration of the Scriptures, and the supernatural origin of Christianity.",TRUE
"Infidel (n.) One who does not believe in the prevailing religious faith; especially, one who does not believe in the divine origin and authority of Christianity; a Mohammedan; a heathen; a freethinker.",FALSE
Infidelities (pl. ) of Infidelity,TRUE
"Infidelity (n.) Want of faith or belief in some religious system; especially, a want of faith in, or disbelief of, the inspiration of the Scriptures, of the divine origin of Christianity.",FALSE
Infidelity (n.) Unfaithfulness to the marriage vow or contract; violation of the marriage covenant by adultery.,TRUE
"Infidelity (n.) Breach of trust; unfaithfulness to a charge, or to moral obligation; treachery; deceit; as, the infidelity of a servant.",FALSE
"Infield (v. t.) To inclose, as a field.",TRUE
Infield (n.) Arable and manured land kept continually under crop; -- distinguished from outfield.,FALSE
"Infield (n.) The diamond; -- opposed to outfield. See Diamond, n., 5.",TRUE
Infile (v. t.) To arrange in a file or rank; to place in order.,FALSE
"Infilm (v. t.) To cover with a film; to coat thinly; as, to infilm one metal with another in the process of gilding; to infilm the glass of a mirror.",TRUE
Infiltered (imp. & p. p.) of Infilter,FALSE
Infiltering (p. pr. & vb. n.) of Infilter,TRUE
Infilter (v. t. & i.) To filter or sift in.,FALSE
Infiltrated (imp. & p. p.) of Infiltrate,TRUE
Infiltrating (p. pr. & vb. n.) of Infiltrate,FALSE
Infiltrate (v. i.) To enter by penetrating the pores or interstices of a substance; to filter into or through something.,TRUE
Infiltrate (v. t.) To penetrate gradually; -- sometimes used reflexively.,FALSE
"Infiltration (n.) The act or process of infiltrating, as if water into a porous substance, or of a fluid into the cells of an organ or part of the body.",TRUE
Infiltration (n.) The substance which has entered the pores or cavities of a body.,FALSE
Infiltrative (a.) Of or pertaining to infiltration.,TRUE
"Infinite (a.) Unlimited or boundless, in time or space; as, infinite duration or distance.",FALSE
"Infinite (a.) Without limit in power, capacity, knowledge, or excellence; boundless; immeasurably or inconceivably great; perfect; as, the infinite wisdom and goodness of God; -- opposed to finite.",TRUE
Infinite (a.) Indefinitely large or extensive; great; vast; immense; gigantic; prodigious.,FALSE
Infinite (a.) Greater than any assignable quantity of the same kind; -- said of certain quantities.,TRUE
"Infinite (a.) Capable of endless repetition; -- said of certain forms of the canon, called also perpetual fugues, so constructed that their ends lead to their beginnings, and the performance may be incessantly repeated.",FALSE
Infinite (n.) That which is infinite; boundless space or duration; infinity; boundlessness.,TRUE
Infinite (n.) An infinite quantity or magnitude.,FALSE
Infinite (n.) An infinity; an incalculable or very great number.,TRUE
Infinite (n.) The Infinite Being; God; the Almighty.,FALSE
"Infinitely (adv.) Without bounds or limits; beyond or below assignable limits; as, an infinitely large or infinitely small quantity.",TRUE
Infinitely (adv.) Very; exceedingly; vastly; highly; extremely.,FALSE
Infiniteness (n.) The state or quality of being infinite; infinity; greatness; immensity.,TRUE
Infinitesimal (a.) Infinitely or indefinitely small; less than any assignable quantity or value; very small.,FALSE
Infinitesimal (n.) An infinitely small quantity; that which is less than any assignable quantity.,TRUE
Infinitesimally (adv.) By infinitesimals; in infinitely small quantities; in an infinitesimal degree.,FALSE
Infinitival (a.) Pertaining to the infinite mood.,TRUE
Infinitive (n.) Unlimited; not bounded or restricted; undefined.,FALSE
Infinitive (n.) An infinitive form of the verb; a verb in the infinitive mood; the infinitive mood.,TRUE
Infinitive (adv.) In the manner of an infinitive mood.,FALSE
"Infinito (a.) Infinite; perpetual, as a canon whose end leads back to the beginning. See Infinite, a., 5.",TRUE
"Infinitude (n.) The quality or state of being infinite, or without limits; infiniteness.",FALSE
Infinitude (n.) Infinite extent; unlimited space; immensity; infinity.,TRUE
Infinitude (n.) Boundless number; countless multitude.,FALSE
Infinituple (a.) Multipied an infinite number of times.,TRUE
Infinities (pl. ) of Infinity,FALSE
"Infinity (n.) Unlimited extent of time, space, or quantity; eternity; boundlessness; immensity.",TRUE
"Infinity (n.) Unlimited capacity, energy, excellence, or knowledge; as, the infinity of God and his perfections.",FALSE
Infinity (n.) Endless or indefinite number; great multitude; as an infinity of beauties.,TRUE
Infinity (n.) A quantity greater than any assignable quantity of the same kind.,FALSE
"Infinity (n.) That part of a line, or of a plane, or of space, which is infinitely distant. In modern geometry, parallel lines or planes are sometimes treated as lines or planes meeting at infinity.",TRUE
"Infirm (a.) Not firm or sound; weak; feeble; as, an infirm body; an infirm constitution.",FALSE
Infirm (a.) Weak of mind or will; irresolute; vacillating.,TRUE
Infirm (a.) Not solid or stable; insecure; precarious.,FALSE
Infirm (v. t.) To weaken; to enfeeble.,TRUE
"Infirmarian (n.) A person dwelling in, or having charge of, an infirmary, esp. in a monastic institution.",FALSE
Infirmaries (pl. ) of Infirmary,TRUE
"Infirmary (n.) A hospital, or place where the infirm or sick are lodged and nursed gratuitously, or where out-patients are treated.",FALSE
"Infirmative (a.) Weakening; annulling, or tending to make void.",TRUE
Infirmatory (n.) An infirmary.,FALSE
Infirmities (pl. ) of Infirmity,TRUE
"Infirmity (a.) The state of being infirm; feebleness; an imperfection or weakness; esp., an unsound, unhealthy, or debilitated state; a disease; a malady; as, infirmity of body or mind.",FALSE
Infirmity (a.) A personal frailty or failing; foible; eccentricity; a weakness or defect.,TRUE
Infirmly (adv.) In an infirm manner.,FALSE
Infirmness (n.) Infirmity; feebleness.,TRUE
Infixed (imp. & p. p.) of Infix,FALSE
Infixing (p. pr. & vb. n.) of Infix,TRUE
"Infix (v. t.) To set; to fasten or fix by piercing or thrusting in; as, to infix a sting, spear, or dart.",FALSE
"Infix (v. t.) To implant or fix; to instill; to inculcate, as principles, thoughts, or instructions; as, to infix good principles in the mind, or ideas in the memory.",TRUE
Infix (n.) Something infixed.,FALSE
Inflamed (imp. & p. p.) of Inflame,TRUE
Inflaming (p. pr. & vb. n.) of Inflame,FALSE
"Inflame (v. t.) To set on fire; to kindle; to cause to burn, flame, or glow.",TRUE
"Inflame (v. t.) Fig.: To kindle or intensify, as passion or appetite; to excite to an excessive or unnatural action or heat; as, to inflame desire.",FALSE
Inflame (v. t.) To provoke to anger or rage; to exasperate; to irritate; to incense; to enrage.,TRUE
"Inflame (v. t.) To put in a state of inflammation; to produce morbid heat, congestion, or swelling, of; as, to inflame the eyes by overwork.",FALSE
Inflame (v. t.) To exaggerate; to enlarge upon.,TRUE
"Inflame (v. i.) To grow morbidly hot, congested, or painful; to become angry or incensed.",FALSE
Inflamed (p. a.) Set on fire; enkindled; heated; congested; provoked; exasperated.,TRUE
"Inflamed (p. a.) Represented as burning, or as adorned with tongues of flame.",FALSE
Inflamer (n.) The person or thing that inflames.,TRUE
Inflammabillty (n.) Susceptibility of taking fire readily; the state or quality of being inflammable.,FALSE
"Inflammable (a.) Capable of being easily set fire; easily enkindled; combustible; as, inflammable oils or spirits.",TRUE
"Inflammable (a.) Excitable; irritable; irascible; easily provoked; as, an inflammable temper.",FALSE
Inflammableness (n.) The quality or state of being inflammable; inflammability.,TRUE
Inflammbly (adv.) In an inflammable manner.,FALSE
"Inflammation (n.) The act of inflaming, kindling, or setting on fire; also, the state of being inflamed.",TRUE
"Inflammation (n.) A morbid condition of any part of the body, consisting in congestion of the blood vessels, with obstruction of the blood current, and growth of morbid tissue. It is manifested outwardly by redness and swelling, attended with heat and pain.",FALSE
"Inflammation (n.) Violent excitement; heat; passion; animosity; turbulence; as, an inflammation of the mind, of the body politic, or of parties.",TRUE
Inflammative (a.) Inflammatory.,FALSE
"Inflammatory (a.) Tending to inflame, kindle, or irritate.",TRUE
"Inflammatory (a.) Tending to excite anger, animosity, tumult, or sedition; seditious; as, inflammatory libels, writings, speeches, or publications.",FALSE
"Inflammatory (a.) Accompanied with, or tending to cause, preternatural heat and excitement of arterial action; as, an inflammatory disease.",TRUE
Inflatable (a.) That may be inflated.,FALSE
Inflate (p. a.) Blown in; inflated.,TRUE
Inflated (imp. & p. p.) of Inflate,FALSE
Inflating (p. pr. & vb. n.) of Inflate,TRUE
"Inflate (v. t.) To swell or distend with air or gas; to dilate; to expand; to enlarge; as, to inflate a bladder; to inflate the lungs.",FALSE
"Inflate (v. t.) Fig.: To swell; to puff up; to elate; as, to inflate one with pride or vanity.",TRUE
"Inflate (v. t.) To cause to become unduly expanded or increased; as, to inflate the currency.",FALSE
Inflate (v. i.) To expand; to fill; to distend.,TRUE
"Inflated (a.) Filled, as with air or gas; blown up; distended; as, a balloon inflated with gas.",FALSE
"Inflated (a.) Turgid; swelling; puffed up; bombastic; pompous; as, an inflated style.",TRUE
"Inflated (a.) Hollow and distended, as a perianth, corolla, nectary, or pericarp.",FALSE
"Inflated (a.) Distended or enlarged fictitiously; as, inflated prices, etc.",TRUE
"Inflater (n.) One who, or that which, inflates; as, the inflaters of the stock exchange.",FALSE
Inflatingly (adv.) In a manner tending to inflate.,TRUE
"Inflation (n.) The act or process of inflating, or the state of being inflated, as with air or gas; distention; expansion; enlargement.",FALSE
"Inflation (n.) The state of being puffed up, as with pride; conceit; vanity.",TRUE
"Inflation (n.) Undue expansion or increase, from overissue; -- said of currency.",FALSE
Inflationist (n.) One who favors an increased or very large issue of paper money.,TRUE
Inflatus (v. t.) A blowing or breathing into; inflation; inspiration.,FALSE
Inflected (imp. & p. p.) of Inflect,TRUE
Inflecting (p. pr. & vb. n.) of Inflect,FALSE
"Inflect (v. t.) To turn from a direct line or course; to bend; to incline, to deflect; to curve; to bow.",TRUE
"Inflect (v. t.) To vary, as a noun or a verb in its terminations; to decline, as a noun or adjective, or to conjugate, as a verb.",FALSE
"Inflect (v. t.) To modulate, as the voice.",TRUE
Inflected (a.) Bent; turned; deflected.,FALSE
"Inflected (a.) Having inflections; capable of, or subject to, inflection; inflective.",TRUE
"Inflection (n.) The act of inflecting, or the state of being inflected.",FALSE
Inflection (n.) A bend; a fold; a curve; a turn; a twist.,TRUE
"Inflection (n.) A slide, modulation, or accent of the voice; as, the rising and the falling inflection.",FALSE
"Inflection (n.) The variation or change which words undergo to mark case, gender, number, comparison, tense, person, mood, voice, etc.",TRUE
Inflection (n.) Any change or modification in the pitch or tone of the voice.,FALSE
"Inflection (n.) A departure from the monotone, or reciting note, in chanting.",TRUE
Inflection (n.) Same as Diffraction.,FALSE
"Inflectional (a.) Of or pertaining to inflection; having, or characterized by, inflection.",TRUE
"Inflective (a.) Capable of, or pertaining to, inflection; deflecting; as, the inflective quality of the air.",FALSE
"Inflective (a.) Inflectional; characterized by variation, or change in form, to mark case, tense, etc.; subject to inflection.",TRUE
Inflesh (v. t.) To incarnate.,FALSE
Inflex (v. t.) To bend; to cause to become curved; to make crooked; to deflect.,TRUE
Inflexed (a.) Turned; bent.,FALSE
"Inflexed (a.) Bent or turned abruptly inwards, or toward the axis, as the petals of a flower.",TRUE
"Inflexibility (n.) The quality or state of being inflexible, or not capable of being bent or changed; unyielding stiffness; inflexibleness; rigidity; firmness of will or purpose; unbending pertinacity; steadfastness; resoluteness; unchangeableness; obstinacy.",FALSE
Inflexible (a.) Not capable of being bent; stiff; rigid; firm; unyielding.,TRUE
"Inflexible (a.) Firm in will or purpose; not to be turned, changed, or altered; resolute; determined; unyieding; inexorable; stubborn.",FALSE
Inflexible (a.) Incapable of change; unalterable; immutable.,TRUE
Inflexibleness (n.) The quality or state of being inflexible; inflexibility; rigidity; firmness.,FALSE
Inflexibly (adv.) In an inflexible manner.,TRUE
Inflexion (n.) Inflection.,FALSE
Inflexive (a.) Inflective.,TRUE
Inflexive (a.) Inflexible.,FALSE
Inflexure (n.) An inflection; a bend or fold.,TRUE
Inflicted (imp. & p. p.) of Inflict,FALSE
Inflicting (p. pr. & vb. n.) of Inflict,TRUE
"Inflict (v. t.) To give, cause, or produce by striking, or as if by striking; to apply forcibly; to lay or impose; to send; to cause to bear, feel, or suffer; as, to inflict blows; to inflict a wound with a dagger; to inflict severe pain by ingratitude; to inflict punishment on an offender; to inflict the penalty of death on a criminal.",FALSE
Inflicter (n.) One who inflicts.,TRUE
"Infliction (n.) The act of inflicting or imposing; as, the infliction of torment, or of punishment.",FALSE
"Infliction (n.) That which is inflicted or imposed, as punishment, disgrace, calamity, etc.",TRUE
Inflictive (a.) Causing infliction; acting as an infliction.,FALSE
Inflorescence (n.) A flowering; the putting forth and unfolding of blossoms.,TRUE
"Inflorescence (n.) The mode of flowering, or the general arrangement and disposition of the flowers with reference to the axis, and to each other.",FALSE
Inflorescence (n.) An axis on which all the flower buds.,TRUE
Inflow (v. i.) To flow in.,FALSE
Influence (n.) A flowing in or upon; influx.,TRUE
"Influence (n.) Hence, in general, the bringing about of an effect, phusical or moral, by a gradual process; controlling power quietly exerted; agency, force, or tendency of any kind which the sun exerts on animal and vegetable life; the influence of education on the mind; the influence, according to astrologers,of the stars over affairs.",FALSE
"Influence (n.) Power or authority arising from elevated station, excelence of character or intellect, wealth, etc.; reputation; acknowledged ascendency; as, he is a man of influence in the community.",TRUE
Influence (n.) Induction.,FALSE
Influenced (imp. & p. p.) of Influence,TRUE
Influencing (p. pr. & vb. n.) of Influence,FALSE
"Influence (v. t.) To control or move by power, physical or moral; to affect by gentle action; to exert an influence upon; to modify, bias, or sway; to move; to persuade; to induce.",TRUE
"Influencer (n.) One who, or that which, influences.",FALSE
Influencive (a.) Tending toinfluence; influential.,TRUE
Influent (a.) Flowing in.,FALSE
Influent (a.) Exerting influence; influential.,TRUE
"Inflential (a.) Exerting or possessing influence or power; potent; efficacious; effective; strong; having authority or ascendency; as, an influential man, station, argument, etc.",FALSE
Influentially (adv.) In an influential manner.,TRUE
"Influenza (n.) An epidemic affection characterized by acute nasal catarrh, or by inflammation of the throat or the bronchi, and usually accompanied by fever.",FALSE
"Influx (n.) The act of flowing in; as, an influx of light.",TRUE
"Influx (n.) A coming in; infusion; intromission; introduction; importation in abundance; also, that which flows or comes in; as, a great influx of goods into a country, or an influx of gold and silver.",FALSE
Influx (n.) Influence; power.,TRUE
Influxion (n.) A flowing in; infusion.,FALSE
Influxious (a.) Influential.,TRUE
Influxive (a.) Having a tendency to flow in; having influence; influential.,FALSE
Influxively (adv.) By influxion.,TRUE
Infolded (imp. & p. p.) of Infold,FALSE
Infolding (p. pr. & vb. n.) of Infold,TRUE
Infold (v. t.) To wrap up or cover with folds; to envelop; to inwrap; to inclose; to involve.,FALSE
Infold (v. t.) To clasp with the arms; to embrace.,TRUE
Infoldment (n.) The act of infolding; the state of being infolded.,FALSE
"Infoliate (v. t.) To cover or overspread with, or as with, leaves.",TRUE
Inform (a.) Without regular form; shapeless; ugly; deformed.,FALSE
Informed (imp. & p. p.) of Inform,TRUE
Informing (p. pr. & vb. n.) of Inform,FALSE
Inform (v. t.) To give form or share to; to give vital ororganizing power to; to give life to; to imbue and actuate with vitality; to animate; to mold; to figure; to fashion.,TRUE
Inform (v. t.) To communicate knowledge to; to make known to; to acquaint; to advise; to instruct; to tell; to notify; to enlighten; -- usually followed by of.,FALSE
"Inform (v. t.) To communicate a knowledge of facts to,by way of accusation; to warn against anybody.",TRUE
Inform (v. t.) To take form; to become visible or manifest; to appear.,FALSE
Inform (v. t.) To give intelligence or information; to tell.,TRUE
"Informal (a.) Not in the regular, usual, or established form; not according to official, conventional, prescribed, or customary forms or rules; irregular; hence, without ceremony; as, an informal writting, proceeding, or visit.",FALSE
Informal (a.) Deranged in mind; out of one's senses.,TRUE
Informalities (pl. ) of Informality,FALSE
"Informality (n.) The state of being informal; want of regular, prescribed, or customary form; as, the informality of legal proceedings.",TRUE
"Informality (n.) An informal, unconventional, or unofficial act or proceeding; something which is not in proper or prescribed form or does not conform to the established rule.",FALSE
Informally (adv.) In an informal manner.,TRUE
"Informant (v. t.) One who, or that which, informs, animates, or vivifies.",FALSE
Informant (v. t.) One who imparts information or instruction.,TRUE
Informant (v. t.) One who offers an accusation; an informer. See Informer.,FALSE
"Information (v. t.) The act of informing, or communicating knowledge or intelligence.",TRUE
"Information (v. t.) News, advice, or knowledge, communicated by others or obtained by personal study and investigation; intelligence; knowledge derived from reading, observation, or instruction.",FALSE
"Information (v. t.) A proceeding in the nature of a prosecution for some offens against the government, instituted and prosecuted, really or nominally, by some authorized public officer on behalt of the government. It differs from an indictment in criminal cases chiefly in not being based on the finding of a grand juri. See Indictment.",TRUE
"Informative (a.) Having power to inform, animate, or vivify.",FALSE
"Informatory (a.) Full of, or conveying, information; instructive.",TRUE
Informed (a.) Unformed or ill-formed; deformed; shapeless.,FALSE
"Informer (v.) One who informs, animates, or inspires.",TRUE
"Informer (v.) One who informs, or imparts knowledge or news.",FALSE
Informer (v.) One who informs a magistrate of violations of law; one who informs against another for violation of some law or penal statute.,TRUE
Informidable (a.) Not formidable; not to be feared or dreaded.,FALSE
Informity (a.) Want of regular form; shapelessness.,TRUE
Informous (a.) Of irregular form; shapeless.,FALSE
Infortunate (a.) Unlucky; unfortunate.,TRUE
Infortune (n.) Misfortune.,FALSE
Infortuned (a.) Unfortunate.,TRUE
Infound (v. t.) To pour in; to infuse.,FALSE
Infra (adv.) Below; beneath; under; after; -- often used as a prefix.,TRUE
"Infra-axillary (a.) Situated below the axil, as a bud.",FALSE
Infrabranchial (a.) Below the gills; -- applied to the ventral portion of the pallial chamber in the lamellibranchs.,TRUE
"Infraclavicular (a.) Below the clavicle; as, the infraclavicular fossa.",FALSE
Infract (a.) Not broken or fractured; unharmed; whole.,TRUE
Infracted (imp. & p. p.) of Infract,FALSE
Infracting (p. pr. & vb. n.) of Infract,TRUE
Infract (v. t.) To break; to infringe.,FALSE
Infractible (a.) Capable of being broken.,TRUE
"Infraction (n.) The act of infracting or breaking; breach; violation; nonobservance; infringement; as, an infraction of a treaty, compact, rule, or law.",FALSE
Infractor (n.) One who infracts or infringes; a violator; a breaker.,TRUE
Infragrant (a.) Not fragrant.,FALSE
Infrahyoid (a.) Same as Hyosternal (a).,TRUE
Infralabial (a.) Below the lower lip; -- said of certain scales of reptiles and fishes.,FALSE
Infralapsarian (n.) One of that class of Calvinists who consider the decree of election as contemplating the apostasy as past and the elect as being at the time of election in a fallen and guilty state; -- opposed to Supralapsarian. The former considered the election of grace as a remedy for an existing evil; the latter regarded the fall as a part of God's original purpose in regard to men.,TRUE
"Infralapsarian (a.) Of or pertaining to the Infralapsarians, or to their doctrine.",FALSE
"Infralapsarianism (n.) The doctrine, belief, or principles of the Infralapsarians.",TRUE
"Inframarginal (a.) Below the margin; submarginal; as, an inframarginal convolution of the brain.",FALSE
"Inframaxillary (a.) Under the lower jaw; submaxillary; as, the inframaxillary nerve.",TRUE
Inframaxillary (a.) Of or pertaining to the lower iaw.,FALSE
"Inframedian (a.) Of or pertaining to the interval or zone along the sea bottom, at the depth of between fifty and one hundred fathoms.",TRUE
Inframundane (a.) Lying or situated beneath the world.,FALSE
Infranchise (v. t.) See Enfranchise.,TRUE
Infrangibility (n.) The quality or state of being infrangible; infrangibleness.,FALSE
"Infrangible (a.) Not capable of being broken or separated into parts; as, infrangible atoms.",TRUE
Infrangible (a.) Not to be infringed or violated.,FALSE
Infrangibleness (n.) The state or quality of being infrangible; infrangibility.,TRUE
"Infraocular (a.) Situated below the eyes, as the antenna of certain insects.",FALSE
"Infraorbital (a.) Below the orbit; as, the infraorbital foramen; the infraorbital nerve.",TRUE
Infrapose (v. t.) To place under or beneath.,FALSE
Infraposition (n.) A situation or position beneath.,TRUE
"Infrascapular (a.) Beneath the scapula, or shoulder blade; subscapular.",FALSE
"Infraspinal (a.) Below the vertebral column, subvertebral.",TRUE
Infraspinal (a.) Below the spine; infraspinate; infraspinous.,FALSE
Infraspinate (a.) Alt. of Infraspinous,TRUE
"Infraspinous (a.) Below the spine; infraspinal; esp., below the spine of the scapula; as, the infraspinous fossa; the infraspinate muscle.",FALSE
"Infrastapedial (a.) Of or pertaining to a part of the columella of the ear, which in many animals projects below the connection with the stapes.",TRUE
Infrastapedial (n.) The infrastapedial part of the columella.,FALSE
"Infrasternal (a.) Below the sternum; as, the infrasternal depression, or pit of the stomach.",TRUE
Infratemporal (a.) Below the temple; below the temporal bone.,FALSE
Infraterritorial (a.) Within the territory of a state.,TRUE
"Infratrochlear (a.) Below a trochlea, or pulley; -- applied esp. to one of the subdivisions of the trigeminal nerve.",FALSE
Infrequence (n.) Alt. of Infrequency,TRUE
"Infrequency (n.) The state of rarely occuring; uncommonness; rareness; as, the infrquence of his visits.",FALSE
Infrequency (n.) The state of not being frequented; solitude; isolation; retirement; seclusion.,TRUE
Infrequent (a.) Seldom happening or occurring; rare; uncommon; unusual.,FALSE
Infrequently (adv.) Not frequently; rarely.,TRUE
Infrigidate (v. t.) To chill; to make cold; to cool.,FALSE
Infrigidation (n.) The act of chilling or causing to become cold; a chilling; coldness; congelation.,TRUE
